[{"code":"0101","name":"哲学","category":"哲学","degreeType":"学硕"},{"code":"0201","name":"理论经济学","category":"经济学","degreeType":"学硕"},{"code":"0202","name":"应用经济学","category":"经济学","degreeType":"学硕"},{"code":"0251","name":"金融","category":"经济学","degreeType":"专硕"},{"code":"0252","name":"应用统计","category":"经济学","degreeType":"专硕"},{"code":"0253","name":"税务","category":"经济学","degreeType":"专硕"},{"code":"0254","name":"国际商务","category":"经济学","degreeType":"专硕"},{"code":"0255","name":"保险","category":"经济学","degreeType":"专硕"},{"code":"0256","name":"资产评估","category":"经济学","degreeType":"专硕"},{"code":"0301","name":"法学","category":"法学","degreeType":"学硕"},{"code":"0302","name":"政治学","category":"法学","degreeType":"学硕"},{"code":"0303","name":"社会学","category":"法学","degreeType":"学硕"},{"code":"0304","name":"民族学","category":"法学","degreeType":"学硕"},{"code":"0305","name":"马克思主义理论","category":"法学","degreeType":"学硕"},{"code":"0306","name":"公安学","category":"法学","degreeType":"学硕"},{"code":"0307","name":"中共党史党建学","category":"法学","degreeType":"学硕"},{"code":"0308","name":"纪检监察学","category":"法学","degreeType":"学硕"},{"code":"0351","name":"法律","category":"法学","degreeType":"专硕"},{"code":"0352","name":"社会工作","category":"法学","degreeType":"专硕"},{"code":"0353","name":"警务","category":"法学","degreeType":"专硕"},{"code":"0354","name":"知识产权","category":"法学","degreeType":"专硕"},{"code":"0355","name":"国际事务","category":"法学","degreeType":"专硕"},{"code":"0401","name":"教育学","category":"教育学","degreeType":"学硕"},{"code":"0402","name":"心理学","category":"教育学","degreeType":"学硕"},{"code":"0403","name":"体育学","category":"教育学","degreeType":"学硕"},{"code":"0451","name":"教育","category":"教育学","degreeType":"专硕"},{"code":"0452","name":"体育","category":"教育学","degreeType":"专硕"},{"code":"0453","name":"国际中文教育","category":"教育学","degreeType":"专硕"},{"code":"0454","name":"应用心理","category":"教育学","degreeType":"专硕"},{"code":"0501","name":"中国语言文学","category":"文学","degreeType":"学硕"},{"code":"0502","name":"外国语言文学","category":"文学","degreeType":"学硕"},{"code":"0503","name":"新闻传播学","category":"文学","degreeType":"学硕"},{"code":"0551","name":"翻译","category":"文学","degreeType":"专硕"},{"code":"0552","name":"新闻与传播","category":"文学","degreeType":"专硕"},{"code":"0553","name":"出版","category":"文学","degreeType":"专硕"},{"code":"0601","name":"考古学","category":"历史学","degreeType":"学硕"},{"code":"0602","name":"中国史","category":"历史学","degreeType":"学硕"},{"code":"0603","name":"世界史","category":"历史学","degreeType":"学硕"},{"code":"0701","name":"数学","category":"理学","degreeType":"学硕"},{"code":"0702","name":"物理学","category":"理学","degreeType":"学硕"},{"code":"0703","name":"化学","category":"理学","degreeType":"学硕"},{"code":"0704","name":"天文学","category":"理学","degreeType":"学硕"},{"code":"0705","name":"地理学","category":"理学","degreeType":"学硕"},{"code":"0706","name":"大气科学","category":"理学","degreeType":"学硕"},{"code":"0707","name":"海洋科学","category":"理学","degreeType":"学硕"},{"code":"0708","name":"地球物理学","category":"理学","degreeType":"学硕"},{"code":"0709","name":"地质学","category":"理学","degreeType":"学硕"},{"code":"0710","name":"生物学","category":"理学","degreeType":"学硕"},{"code":"0711","name":"系统科学","category":"理学","degreeType":"学硕"},{"code":"0712","name":"科学技术史","category":"理学","degreeType":"学硕"},{"code":"0713","name":"生态学","category":"理学","degreeType":"学硕"},{"code":"0714","name":"统计学","category":"理学","degreeType":"学硕"},{"code":"0801","name":"力学","category":"工学","degreeType":"学硕"},{"code":"0802","name":"机械工程","category":"工学","degreeType":"学硕"},{"code":"0803","name":"光学工程","category":"工学","degreeType":"学硕"},{"code":"0804","name":"仪器科学与技术","category":"工学","degreeType":"学硕"},{"code":"0805","name":"材料科学与工程","category":"工学","degreeType":"学硕"},{"code":"0806","name":"冶金工程","category":"工学","degreeType":"学硕"},{"code":"0807","name":"动力工程及工程热物理","category":"工学","degreeType":"学硕"},{"code":"0808","name":"电气工程","category":"工学","degreeType":"学硕"},{"code":"0809","name":"电子科学与技术","category":"工学","degreeType":"学硕"},{"code":"0810","name":"信息与通信工程","category":"工学","degreeType":"学硕"},{"code":"0811","name":"控制科学与工程","category":"工学","degreeType":"学硕"},{"code":"0812","name":"计算机科学与技术","category":"工学","degreeType":"学硕"},{"code":"0813","name":"建筑学","category":"工学","degreeType":"学硕"},{"code":"0814","name":"土木工程","category":"工学","degreeType":"学硕"},{"code":"0815","name":"水利工程","category":"工学","degreeType":"学硕"},{"code":"0816","name":"测绘科学与技术","category":"工学","degreeType":"学硕"},{"code":"0817","name":"化学工程与技术","category":"工学","degreeType":"学硕"},{"code":"0818","name":"地质资源与地质工程","category":"工学","degreeType":"学硕"},{"code":"0819","name":"矿业工程","category":"工学","degreeType":"学硕"},{"code":"0820","name":"石油与天然气工程","category":"工学","degreeType":"学硕"},{"code":"0821","name":"纺织科学与工程","category":"工学","degreeType":"学硕"},{"code":"0822","name":"轻工技术与工程","category":"工学","degreeType":"学硕"},{"code":"0823","name":"交通运输工程","category":"工学","degreeType":"学硕"},{"code":"0824","name":"船舶与海洋工程","category":"工学","degreeType":"学硕"},{"code":"0825","name":"航空宇航科学与技术","category":"工学","degreeType":"学硕"},{"code":"0826","name":"兵器科学与技术","category":"工学","degreeType":"学硕"},{"code":"0827","name":"核科学与技术","category":"工学","degreeType":"学硕"},{"code":"0828","name":"农业工程","category":"工学","degreeType":"学硕"},{"code":"0829","name":"林业工程","category":"工学","degreeType":"学硕"},{"code":"0830","name":"环境科学与工程","category":"工学","degreeType":"学硕"},{"code":"0831","name":"生物医学工程","category":"工学","degreeType":"学硕"},{"code":"0832","name":"食品科学与工程","category":"工学","degreeType":"学硕"},{"code":"0833","name":"城乡规划学","category":"工学","degreeType":"学硕"},{"code":"0835","name":"软件工程","category":"工学","degreeType":"学硕"},{"code":"0836","name":"生物工程","category":"工学","degreeType":"学硕"},{"code":"0837","name":"安全科学与工程","category":"工学","degreeType":"学硕"},{"code":"0838","name":"公安技术","category":"工学","degreeType":"学硕"},{"code":"0839","name":"网络空间安全","category":"工学","degreeType":"学硕"},{"code":"0851","name":"建筑","category":"工学","degreeType":"专硕"},{"code":"0853","name":"城乡规划","category":"工学","degreeType":"专硕"},{"code":"0854","name":"电子信息","category":"工学","degreeType":"专硕"},{"code":"0855","name":"机械","category":"工学","degreeType":"专硕"},{"code":"0856","name":"材料与化工","category":"工学","degreeType":"专硕"},{"code":"0857","name":"资源与环境","category":"工学","degreeType":"专硕"},{"code":"0858","name":"能源动力","category":"工学","degreeType":"专硕"},{"code":"0859","name":"土木水利","category":"工学","degreeType":"专硕"},{"code":"0860","name":"生物与医药","category":"工学","degreeType":"专硕"},{"code":"0861","name":"交通运输","category":"工学","degreeType":"专硕"},{"code":"0862","name":"风景园林","category":"工学","degreeType":"专硕"},{"code":"0901","name":"作物学","category":"农学","degreeType":"学硕"},{"code":"0902","name":"园艺学","category":"农学","degreeType":"学硕"},{"code":"0903","name":"农业资源与环境","category":"农学","degreeType":"学硕"},{"code":"0904","name":"植物保护","category":"农学","degreeType":"学硕"},{"code":"0905","name":"畜牧学","category":"农学","degreeType":"学硕"},{"code":"0906","name":"兽医学","category":"农学","degreeType":"学硕"},{"code":"0907","name":"林学","category":"农学","degreeType":"学硕"},{"code":"0908","name":"水产","category":"农学","degreeType":"学硕"},{"code":"0909","name":"草学","category":"农学","degreeType":"学硕"},{"code":"0951","name":"农业","category":"农学","degreeType":"专硕"},{"code":"0952","name":"兽医","category":"农学","degreeType":"专硕"},{"code":"0953","name":"风景园林","category":"农学","degreeType":"专硕"},{"code":"0954","name":"林业","category":"农学","degreeType":"专硕"},{"code":"1001","name":"基础医学","category":"医学","degreeType":"学硕"},{"code":"1002","name":"临床医学","category":"医学","degreeType":"学硕"},{"code":"1003","name":"口腔医学","category":"医学","degreeType":"学硕"},{"code":"1004","name":"公共卫生与预防医学","category":"医学","degreeType":"学硕"},{"code":"1005","name":"中医学","category":"医学","degreeType":"学硕"},{"code":"1006","name":"中西医结合","category":"医学","degreeType":"学硕"},{"code":"1007","name":"药学","category":"医学","degreeType":"学硕"},{"code":"1008","name":"中药学","category":"医学","degreeType":"学硕"},{"code":"1009","name":"特种医学","category":"医学","degreeType":"学硕"},{"code":"1011","name":"护理学","category":"医学","degreeType":"学硕"},{"code":"1012","name":"法医学","category":"医学","degreeType":"学硕"},{"code":"1051","name":"临床医学","category":"医学","degreeType":"专硕"},{"code":"1052","name":"口腔医学","category":"医学","degreeType":"专硕"},{"code":"1053","name":"公共卫生","category":"医学","degreeType":"专硕"},{"code":"1054","name":"护理","category":"医学","degreeType":"专硕"},{"code":"1055","name":"药学","category":"医学","degreeType":"专硕"},{"code":"1056","name":"中药","category":"医学","degreeType":"专硕"},{"code":"1057","name":"中医","category":"医学","degreeType":"专硕"},{"code":"1058","name":"医学技术","category":"医学","degreeType":"专硕"},{"code":"1059","name":"针灸","category":"医学","degreeType":"专硕"},{"code":"1101","name":"军事思想与军事历史","category":"军事学","degreeType":"学硕"},{"code":"1102","name":"战略学","category":"军事学","degreeType":"学硕"},{"code":"1103","name":"联合作战学","category":"军事学","degreeType":"学硕"},{"code":"1104","name":"军兵种作战学","category":"军事学","degreeType":"学硕"},{"code":"1105","name":"军队指挥学","category":"军事学","degreeType":"学硕"},{"code":"1106","name":"军队政治工作学","category":"军事学","degreeType":"学硕"},{"code":"1107","name":"军事后勤学","category":"军事学","degreeType":"学硕"},{"code":"1108","name":"军事装备学","category":"军事学","degreeType":"学硕"},{"code":"1109","name":"军事管理学","category":"军事学","degreeType":"学硕"},{"code":"1110","name":"军事训练学","category":"军事学","degreeType":"学硕"},{"code":"1111","name":"军事智能","category":"军事学","degreeType":"学硕"},{"code":"1152","name":"联合作战指挥","category":"军事学","degreeType":"专硕"},{"code":"1153","name":"军兵种作战指挥","category":"军事学","degreeType":"专硕"},{"code":"1154","name":"作战指挥保障","category":"军事学","degreeType":"专硕"},{"code":"1155","name":"战时政治工作","category":"军事学","degreeType":"专硕"},{"code":"1156","name":"后勤与装备保障","category":"军事学","degreeType":"专硕"},{"code":"1157","name":"军事训练与管理","category":"军事学","degreeType":"专硕"},{"code":"1201","name":"管理科学与工程","category":"管理学","degreeType":"学硕"},{"code":"1202","name":"工商管理学","category":"管理学","degreeType":"学硕"},{"code":"1204","name":"公共管理学","category":"管理学","degreeType":"学硕"},{"code":"1251","name":"工商管理","category":"管理学",